{
  "schema_version": "1.0.0",
  "tenant_id": "00000000-0000-4000-8000-000000000001",
  "forecast_id": "24000000-0000-4000-8000-000000000001",
  "cell_id": "8861892581fffff",
  "window_start": "2026-08-30T00:00:00Z",
  "window_end": "2026-08-30T06:00:00Z",
  "category": "property",
  "generated_at": "2026-08-29T23:55:00Z",
  "data_as_of": "2026-08-29T23:54:59Z",
  "expected_count": {
    "value": 0.31,
    "lower": 0.08,
    "upper": 0.71,
    "interval_level": 0.9,
    "method": "rolling_origin_block_bootstrap"
  },
  "occurrence_probability": {
    "value": 0.27,
    "lower": 0.12,
    "upper": 0.49,
    "interval_level": 0.9,
    "method": "validation_isotonic",
    "calibration_version": "calibration-demo-one-v1"
  },
  "risk_band": "typical",
  "coverage_ratio": 0.9166666667,
  "drivers": [
    {"feature": "rolling_7_mean", "direction": "higher"}
  ],
  "model_version": "demo-one-poisson-v1",
  "data_version": "features-demo-one-v1",
  "feature_snapshot_version": "forecast-features-demo-one-20260830t000000z-v1",
  "suppression": {"suppressed": false, "reason": null}
}
